{
  "targets": [
    {
      "type": "source",
      "outputPath": "compiled/source",
      "bundle": {
        "include": "qx.*"
      }
    },
    {
      "type": "build",
      "outputPath": "compiled/build"
    }
  ],
  "defaultTarget": "source",
  "locales": [
    "en"
  ],
  "environment": {
    "qx.icontheme": "Tango"
  },
  "applications": [
    {
      "class": "qxl.test8.Application",
      "theme": "qxl.test8.theme.Theme",
      "name": "qxl.test8",
      "bootPath": "source/boot"
    }
  ],
  "eslintConfig": {
    "extends": [
      "@qooxdoo/qx"
    ]
  },
  "$schema": "https://qooxdoo.org/schema/compile-1-0-0.json"
}
