{
  "$schema": "https://qooxdoo.org/schema/compile-1-0-0.json",
  "targets": [
    {
      "type": "source",
      "outputPath": "compiled/source"
    }
  ],
  "defaultTarget": "source",
  "locales": ["en"],
  "libraries": [
    ".",
    "../../../../.."
  ],
  "applications": [
    {
      "class": "unknownfont.Application",
      "theme": "qx.theme.Simple",
      "name": "unknownfont"
    }
  ]
}
