{
  "$schema": "https://qooxdoo.org/schema/compile-1-0-0.json",
  "targets": [
    {
      "type": "source",
      "outputPath": "compiled/source",
      "bundle": {
        "include": "qx.*"
      }
    },
    {
      "type": "build",
      "outputPath": "compiled/build"
    }
  ],
  "defaultTarget": "source",
  "locales": ["en"],
  "environment": {
      "qx.icontheme": "Tango"
  },
  "applications": [
    {
      "class": "multipleRowRenderers.Application",
      "theme": "multipleRowRenderers.theme.Theme",
      "name": "multipleRowRenderers",
      "bootPath": "source/boot"
    }
  ],
  "libraries": [
    ".",
    "/Users/derrell/ME/qooxdoo.git"
  ]
}
