{
  "$schema": "https://raw.githubusercontent.com/qooxdoo/qooxdoo-compiler/master/source/resource/qx/tool/schema/compile-1-0-0.json",
  "targets": [
    {
      "type": "source",
      "outputPath": "compiled/source",
      "bundle": {
        "include": "qx.*"
      }
    },
    {
      "type": "build",
      "outputPath": "compiled/build"
    }
  ],
  "defaultTarget": "source",
  "locales": ["en"],
  "environment": {
      "qx.icontheme": "Tango"
  },
  "applications": [
    {
      "class": "issue553.ApplicationOne",
      "theme": "qx.theme.Indigo",
      "name": "issue553one"
    },
    {
      "class": "issue553.ApplicationTwo",
      "theme": "qx.theme.Indigo",
      "name": "issue553two"
    }
  ]
}
