{
  "targets": [
    {
      "type": "source",
      "outputPath": "compiled/source",
      "babelOptions": {
        "targets": "edge >=18, chrome >= 73, firefox >= 66"
      }
    },
    {
      "type": "build",
      "outputPath": "compiled/build"
    }
  ],
  "defaultTarget": "source",
  "locales": [
    "cs",
    "de",
    "en",
    "es",
    "fr",
    "it",
    "nb",
    "nl",
    "pl",
    "pt",
    "ro",
    "ru",
    "sl",
    "sv"
  ],
  "writeAllTranslations": true,
  "libraries": [
    "../.."
  ],
  "ignores": [
    "loadSass"
  ],
  "applications": [
    {
      "class": "qxl.testtapper.Application",
      "name": "testtapper",
      "theme": "qx.test.theme.Simple",
      "title": "Qooxdoo TestTAPper",
      "environment": {
        "qx.icontheme": "Tango",
        "qxl.testtapper.testNameSpace": "qx.test",
        "qxl.testtapper.browsers": ["chromium"],
        "qx.environment.allowRuntimeMutations": true
      },
      "include": [
        "qx.test.*"
      ],
      "exclude": [
        "qx.tool.*",
        "qx.test.tool.*",
        "qx.test.compiler.*",
        "qx.test.ui.list.*",
        "qx.test.ui.form.virtual.*",
        "qx.test.ui.form.VirtualSelectBox",
        "qx.test.ui.form.AbstractVirtualBox",
        "qx.test.ui.tree.virtual.*",
        "qx.test.ui.treevirtual.*",
        "qx.test.ui.virtual.*"
      ]
    }
  ],
  "sass": {
    "compiler": "legacy"
  },
  "$schema": "https://qooxdoo.org/schema/compile-1-0-0.json"
}
