{
  "$schema": "https://qooxdoo.org/schema/compile-1-0-0.json",
  "targets": [
    {
      "type": "source",
      "outputPath": "compiled/source"
    },
    {
      "type": "build",
      "outputPath": "compiled/build",
      "minify": "beautify"
    }
  ],
  "defaultTarget": "source",
  "locales": ["en"],
  "environment": {
      "qx.icontheme": "Tango"
  },
  "applications": [
    {
      "class": "myapp.Application",
      "theme": "qx.theme.Simple",
      "name": "myapp",
      "bootPath": "source/boot"
    }
  ],
  "libraries": [
    ".", "../mylib"
  ]
}
